{
    "beats": [
        {
            "name": "something_memorable",
            "author": "ejhumphrey@nyu.edu",
            "group": "marl",
            "data": [
                {
                    "time": {
                        "value": 0.336689342,
                        "confidence": 1.0
                    },
                    "label": {
                        "value": 3,
                        "confidence": 1.0
                    }
                },
                {
                    "time": {
                        "value": 1.194807256,
                        "confidence": 1.0
                    },
                    "label": {
                        "value": 4,
                        "confidence": 1.0
                    }
                },
                {
                    "time": {
                        "value": 1.971995464,
                        "confidence": 1.0
                    },
                    "label": {
                        "value": 1,
                        "confidence": 1.0
                    }
                }
            ],
            "timestamp": "Fri Feb 14 10:03:30 2014"
        }
    ],
    "chords": [
        {
            "name": "something_memorable",
            "author": "tmc232@nyu.edu",
            "group": "marl",
            "data": [
                {
                    "start": {
                        "value": 0.0,
                        "confidence": 1.0
                    },
                    "end": {
                        "value": 3.091,
                        "confidence": 1.0
                    },
                    "label": {
                        "value": "N",
                        "confidence": 1.0
                    }
                },
                {
                    "start": {
                        "value": 3.091,
                        "confidence": 1.0
                    },
                    "end": {
                        "value": 3.918,
                        "confidence": 1.0
                    },
                    "label": {
                        "value": "D:min",
                        "confidence": 1.0
                    }
                },
                {
                    "start": {
                        "value": 3.918,
                        "confidence": 1.0
                    },
                    "end": {
                        "value": 4.941,
                        "confidence": 1.0
                    },
                    "label": {
                        "value": "Bb:maj",
                        "confidence": 1.0
                    }
                }
            ],
            "timestamp": "Fri Feb 14 10:11:03 2014"
        }
    ],
    "melody": [
        {
            "name": "something_memorable",
            "author": "justin.salamon@nyu.edu",
            "group": "marl-2",
            "data": [
                {
                    "value": [
                        272.5533807769767,
                        221.338953512844,
                        246.41061581293596,
                        237.26051326467623,
                        251.66279369149845,
                        262.2774372838999,
                        239.4817971016345,
                        256.60144462116006
                    ],
                    "time": [
                        0.12450575,
                        0.25808751,
                        0.36182483,
                        0.48671057,
                        0.5725176,
                        0.70828537,
                        0.82754226,
                        0.96508301
                    ],
                    "confidence": [
                        0.9588612590546348,
                        0.8821113997395683,
                        0.8375719986201495,
                        0.9083711844314711,
                        0.8637670482886021,
                        0.9252344518531272,
                        0.83558739038859,
                        0.8854623259345453
                    ]
                }
            ],
            "timestamp": "Fri Feb 14 10:23:37 2014"
        }
    ],
    "sections": [
        {
            "name": "something_memorable",
            "author": "oriol@nyu.edu",
            "group": "marl",
            "data": [
                {
                    "start": {
                        "value": 0.0,
                        "confidence": 1.0
                    },
                    "end": {
                        "value": 17.025,
                        "confidence": 1.0
                    },
                    "label": {
                        "value": "Intro",
                        "confidence": 1.0
                    }
                },
                {
                    "start": {
                        "value": 17.025,
                        "confidence": 1.0
                    },
                    "end": {
                        "value": 33.54,
                        "confidence": 1.0
                    },
                    "label": {
                        "value": "VerseA",
                        "confidence": 1.0
                    }
                },
                {
                    "start": {
                        "value": 33.54,
                        "confidence": 1.0
                    },
                    "end": {
                        "value": 52.871,
                        "confidence": 1.0
                    },
                    "label": {
                        "value": "Chorus",
                        "confidence": 1.0
                    }
                }
            ],
            "timestamp": "Fri Feb 14 10:11:03 2014"
        }
    ],
    "metadata": {
        "enid": "TR01924500",
        "mbid": "4d4221a4-1c00-4ad3-9f7c-e0457623bad0",
        "artist": "Michael Jackson",
        "title": "Beat It",
        "md5": "63e5ee0470e210d88e7af816a03d2086",
        "duration": "00:04:19",
        "version": "0.1"
    }
}
